{
  "id": "S1-03",
  "arc": "upper",
  "order": 3,
  "title": "길을 고르는 자",
  "subtitle": "육혼산 도주전",
  "synopsis": "추격대보다 먼저 산을 넘으십시오. 피난민의 안내를 받아 동쪽 고개로 가거나, 긴 남쪽 계곡으로 우회할 수 있습니다. 거짓 군령은 시간을 잃고 매복을 부릅니다.",
  "mapId": "luhun-flight",
  "deployment": {
    "forced": [
      "sima_yi",
      "sima_lang"
    ],
    "slots": 2
  },
  "victory": [
    {
      "type": "reach",
      "unit": "sima_yi",
      "target": "east_pass",
      "order": 1
    },
    {
      "type": "reach",
      "unit": "sima_lang",
      "target": "east_pass",
      "order": 2
    },
    {
      "type": "dialogue_complete",
      "target": "mountain_choice",
      "order": 3
    }
  ],
  "defeat": [
    {
      "type": "retreat",
      "unit": "sima_yi"
    },
    {
      "type": "retreat",
      "unit": "sima_lang"
    }
  ],
  "seals": [
    {
      "slot": 1,
      "normal": "clear",
      "extreme": "clear"
    },
    {
      "slot": 2,
      "normal": "no_player_losses",
      "extreme": "no_player_losses"
    },
    {
      "slot": 3,
      "normal": "turn_limit:7",
      "extreme": "turn_limit:6"
    }
  ],
  "difficulty": {
    "normal": {
      "minEnemyLevel": 14,
      "recommendedLevel": 25
    },
    "extreme": {
      "minEnemyLevel": 24,
      "recommendedLevel": 35
    }
  },
  "gimmicks": [
    "M-03"
  ],
  "dialogues": [
    {
      "id": "mountain_choice",
      "text": "길잡이가 속삭인다. “동쪽 고개에는 피난민이 모입니다. 사정을 밝히면 길을 열어 줄 겁니다. 남쪽 계곡은 멀지만 검문이 없지요.” 뒤에서 말발굽 소리가 가까워진다.",
      "options": [
        {
          "id": "talk",
          "text": "피난길임을 밝히고 동쪽 고개의 안내를 받는다. · 짧은 길"
        },
        {
          "id": "ravine",
          "text": "검문을 피하고 남쪽 계곡으로 돌아간다. · 긴 길"
        },
        {
          "id": "bluff",
          "text": "관군의 명령이라 속인다. · 실패 위험을 확인한다",
          "next": "bluff_warning"
        }
      ]
    },
    {
      "id": "bluff_warning",
      "text": "이곳 사람들은 관군의 인장을 잘 안다. 거짓이 드러나면 추격 압박이 2 올라가고 동쪽 궁병 매복이 나타난다.",
      "options": [
        {
          "id": "commit",
          "text": "위험을 감수하고 강행한다. · 압박 +2 / 매복 2부대"
        },
        {
          "id": "back",
          "text": "사실을 밝히고 안내를 받는다."
        }
      ]
    }
  ],
  "events": [
    {
      "id": "luhun/opening",
      "trigger": {
        "type": "battle_start"
      },
      "actions": [
        {
          "type": "play_dialogue",
          "dialogueId": "mountain_choice"
        },
        {
          "type": "spawn_units",
          "side": "enemy",
          "units": [
            {
              "id": "ridge_guard",
              "name": "산길 약탈자",
              "template": "bandit",
              "level": 14,
              "at": {
                "x": 9,
                "y": 3
              },
              "behavior": "hold"
            },
            {
              "id": "ravine_guard",
              "name": "계곡 약탈자",
              "template": "spearman",
              "level": 14,
              "at": {
                "x": 10,
                "y": 9
              },
              "behavior": "hold"
            }
          ]
        }
      ]
    },
    {
      "id": "luhun/talk",
      "trigger": {
        "type": "dialogue_choice",
        "nodeId": "mountain_choice",
        "optionId": "talk"
      },
      "actions": [
        {
          "type": "change_victory",
          "conditions": [
            {
              "type": "reach",
              "unit": "sima_yi",
              "target": "east_pass",
              "order": 1
            },
            {
              "type": "reach",
              "unit": "sima_lang",
              "target": "east_pass",
              "order": 2
            }
          ]
        }
      ]
    },
    {
      "id": "luhun/ravine",
      "trigger": {
        "type": "dialogue_choice",
        "nodeId": "mountain_choice",
        "optionId": "ravine"
      },
      "actions": [
        {
          "type": "change_victory",
          "conditions": [
            {
              "type": "reach",
              "unit": "sima_yi",
              "target": "ravine_exit",
              "order": 1
            },
            {
              "type": "reach",
              "unit": "sima_lang",
              "target": "ravine_exit",
              "order": 2
            }
          ]
        }
      ]
    },
    {
      "id": "luhun/reconsider",
      "trigger": {
        "type": "dialogue_choice",
        "nodeId": "bluff_warning",
        "optionId": "back"
      },
      "actions": [
        {
          "type": "change_victory",
          "conditions": [
            {
              "type": "reach",
              "unit": "sima_yi",
              "target": "east_pass",
              "order": 1
            },
            {
              "type": "reach",
              "unit": "sima_lang",
              "target": "east_pass",
              "order": 2
            }
          ]
        }
      ]
    },
    {
      "id": "luhun/bluff",
      "trigger": {
        "type": "dialogue_choice",
        "nodeId": "bluff_warning",
        "optionId": "commit"
      },
      "actions": [
        {
          "type": "change_victory",
          "conditions": [
            {
              "type": "reach",
              "unit": "sima_yi",
              "target": "east_pass",
              "order": 1
            },
            {
              "type": "reach",
              "unit": "sima_lang",
              "target": "east_pass",
              "order": 2
            }
          ]
        },
        {
          "type": "spawn_units",
          "side": "enemy",
          "units": [
            {
              "template": "archer",
              "level": 14,
              "count": 2,
              "region": "ambush",
              "behavior": "hold"
            }
          ]
        }
      ]
    },
    {
      "id": "luhun/pursuit",
      "trigger": {
        "type": "turn_start",
        "turn": 3,
        "side": "enemy"
      },
      "actions": [
        {
          "type": "spawn_units",
          "side": "enemy",
          "units": [
            {
              "id": "pursuer",
              "name": "추격 기병",
              "template": "cavalry",
              "level": 14,
              "count": 2,
              "region": "pursuers",
              "behavior": "advance"
            }
          ]
        }
      ]
    }
  ],
  "perf": {
    "maxSimultaneousUnits": 8,
    "tier": "A"
  }
}
